source,href,title,date
https://viet69.id/,https://viet69.id/check-hang-em-gai-ban-chuyen-dinh-thon-ha-noi/,Check hàng em gái bán chuyên Đình Thôn – Hà Nội,01/01/2024
https://viet69.id/,https://viet69.id/ep-em-nguoi-yeu-dang-dep-vu-vao-tuong-chich/,Ép em người yêu dáng đẹp vú to vào tường chịch,01/01/2024
https://viet69.id/,https://viet69.id/mot-dem-can-tinh-voi-em-gai-xam-tro-vu/,Một đêm cạn tinh với em gái xăm trổ vú to,01/01/2024
https://viet69.id/,https://viet69.id/chi-may-bay-bong-cuc-mup-show-hang-thu-dam/,Chị máy bay Bông cực múp show hàng thủ dâm,01/01/2024
https://viet69.id/,https://viet69.id/vo-mong-suong-qua-em-ren-la-phong/,Vỗ mông sướng quá em rên la ầm phòng,01/01/2024
https://viet69.id/,https://viet69.id/ga-mai-chi-may-bay-vu-to-moi-cho-choi-khong-bao/,Gạ mãi chị máy bay vú to mới cho chơi không bao,01/01/2024
https://viet69.id/,https://viet69.id/em-gai-khat-tinh-cuoi-ngua-dap-muon-gay-chim/,Em gái khát tình cưỡi ngựa dập muốn gãy chim,01/01/2024
https://viet69.id/,https://viet69.id/sinh-vien-body-cuc-ngon-vua-cuoi-ngua-vua-ren-ri/,Bé sinh viên body cực ngon vừa cưỡi ngựa vừa rên rỉ,01/01/2024
https://viet69.id/,https://viet69.id/bo-sung-clip-sex-tran-ha-linh-cuc-pham/,Bổ sung thêm clip sex Trần Hà Linh cực phẩm,01/01/2024
https://viet69.id/,https://viet69.id/nung-qua-em-coi-mat-na-ra-bu-mut-say/,Nứng quá em cởi mặt nạ ra bú mút say mê,01/01/2024
https://viet69.id/,https://viet69.id/lam-cho-em-suong-roi-anh-muon-xuat-tinh-trong-em-cung-chiu/,Làm cho em sướng rồi anh muốn xuất tinh trong em cũng chịu,01/01/2024
https://viet69.id/,https://viet69.id/anh-cong-nhan-cu-den-khong-bao-voi-em-gai-trong-bo-ngu/,Anh công nhân cu đen không bao với em gái trong bộ đồ ngủ,01/01/2024
https://viet69.id/,https://viet69.id/anh-lam-nhu-em-thich-lam/,Anh làm như thế em thích lắm,01/01/2024
https://viet69.id/,https://viet69.id/check-hang-chi-may-bay-phuong-thanh-ha-noi/,Check hàng chị máy bay Phương Thanh – Hà Nội,01/01/2024
https://viet69.id/,https://viet69.id/vua-di-le-ve-em-ga-lam-nhay-giai-den/,Vừa đi lễ về em gạ làm nháy giải đen,01/01/2024
https://viet69.id/,https://viet69.id/sinh-vien-nam-im-tan-huong-tung-cu-dap/,Bé sinh viên nằm im tận hưởng từng cú dập,01/01/2024
https://viet69.id/,https://viet69.id/vao-quan-ca-phe-em-nghich-sextoy-chay-nuoc-uot-het-ghe/,Vào quán cà phê em nghịch sextoy chảy nước ướt hết ghế,01/01/2024
https://viet69.id/,https://viet69.id/minh-thu-1997-sai-gon-coi-vay-tien-39/,Minh Thư 1997 (Sài Gòn) – Cởi đồ vay tiền – 39,01/01/2024
https://viet69.id/,https://viet69.id/sinh-vien-mong-ren-ri-nhu-meo-con/,Bé sinh viên mông to rên rỉ như mèo con,01/01/2024
https://viet69.id/,https://viet69.id/check-hang-thuy-moon-mong-to-em-ngoay-cuc-nghe/,Check hàng Thủy Moon mông to em ngoáy cực nghệ,01/01/2024
https://viet69.id/,https://viet69.id/yen-nhi-1995-thai-binh-coi-vay-tien-38/,Yến Nhi 1995 (Thái Bình) – Cởi đồ vay tiền – 38,01/01/2024
https://sexdiaryx.us/,https://sexdiaryx.us/cap-sinh-vien-thu-duc-tu-quay/,Cặp sinh viên Thủ Đức tự quay,01/01/2024
https://sexdiaryx.us/,https://sexdiaryx.us/choi-em-thu-thao-lon-lang-min-khong-long/,Chơi em Thu Thảo lồn láng mịn không lông,01/01/2024
https://sexdiaryx.us/,https://sexdiaryx.us/sang-tro-con-ban-than-nho-suc-cu-ho/,Sang trọ con bạn thân nhờ sục cu hộ,01/01/2024
https://sexdiaryx.us/,https://sexdiaryx.us/chich-tru-no-em-teen-2k3/,Chịch trừ nợ em teen 2k3,01/01/2024
https://sexdiaryx.us/,https://sexdiaryx.us/ky-nghi-le-dang-nho-cung-em-nguoi-yeu-hot-girl-vu-to/,Kỳ nghỉ lễ đáng nhớ cùng em người yêu hót girl vú to,01/01/2024
https://sexdiaryx.us/,https://sexdiaryx.us/may-bay-binh-duong-some-2-thang-em-cu-be/,Máy bay Bình Dương some 2 thằng em cu bé,01/01/2024
https://sexdiaryx.us/,https://sexdiaryx.us/chi-thich-bu-anh-ra-uong-tinh/,Chỉ thích bú anh ra uống tinh,01/01/2024
https://sexdiaryx.us/,https://sexdiaryx.us/choi-em-nu-sinh-ao-dai-trang-chi-thich-doggy/,Chơi em nữ sinh áo dài trắng chỉ thích doggy,01/01/2024
https://sexdiaryx.us/,https://sexdiaryx.us/sinh-vien-y-duoc-ha-noi-bu-cu-vay-tien-clip-7p/,Sinh viên y Dược Hà Nội bú cu vay tiền clip 7p,01/01/2024
https://sexdiaryx.us/,https://sexdiaryx.us/mo-cua-hotel-chich-public/,Mở cửa hotel chịch public,01/01/2024
https://sexdiaryx.us/,https://sexdiaryx.us/call-sex-cung-em-gai-que-khi-tam/,Call sex cùng em gái quê khi tắm,01/01/2024
https://sexdiaryx.us/,https://sexdiaryx.us/vua-lam-ve-duoc-vo-bu-cu-thu-gian/,Vừa làm về được vợ bú cu thư giãn,01/01/2024
https://sexdiaryx.us/,https://sexdiaryx.us/cap-doi-chich-public-ngam-nui-rung-tay-bac/,Cặp đôi chịch public ngắm núi rừng Tây Bắc,01/01/2024
https://sexdiaryx.us/,https://sexdiaryx.us/dung-remote-tv-pha-lon-choi-lo-nhi-uong-tinh/,Dùng remote tv phá lồn – chơi lỗ nhị – uống tinh,01/01/2024
https://sexdiaryx.us/,https://sexdiaryx.us/ngoai-tinh-cung-single-mom-hang-nang-p2/,Ngoại tình cùng single mom hạng nặng P2,01/01/2024
https://sexdiaryx.us/,https://sexdiaryx.us/chong-ngoai-tinh-cung-nhan-vien-vo-bat-ghen-phat-hien-clip-bao-dam-p2/,Chồng ngoại tình cùng nhân viên vợ bắt ghen phát hiện clip bạo dâm P2,01/01/2024
https://sexdiaryx.us/,https://sexdiaryx.us/vo-bat-ghen-phat-hien-clip-bao-dam-trong-may-chong-p1/,Vợ bắt ghen phát hiện clip bạo dâm trong máy chồng P1,01/01/2024
https://sexdiaryx.us/,https://sexdiaryx.us/chich-may-bay-xuat-tinh-trong/,Chịch máy bay xuất tinh trong,01/01/2024
https://sexdiaryx.us/,https://sexdiaryx.us/vo-chong-tay-ninh-mo-cua-chich-public/,Vợ chồng Tây Ninh mở cửa chịch public,01/01/2024
https://sexdiaryx.us/,https://sexdiaryx.us/cap-vo-chong-u50-may-bay-da-trang-vu-to/,Cặp vợ chồng u50 máy bay da trắng vú to,01/01/2024
https://sexdiaryx.us/,https://sexdiaryx.us/vay-tien-bu-cu-may-bay-moi/,Vay tiền bú cu máy bay mới,01/01/2024